
         /\      Grafana   /‾‾/  
    /\  /  \     |\  __   /  /   
   /  \/    \    | |/ /  /   ‾‾\ 
  /          \   |   (  |  (‾)  |
 / __________ \  |_|\_\  \_____/ 

     execution: local
        script: load-tests/k6-load-test.js
        output: -

     scenarios: (100.00%) 1 scenario, 100 max VUs, 4m0s max duration (incl. graceful stop):
              * default: Up to 100 looping VUs for 3m30s over 5 stages (gracefulRampDown: 30s, gracefulStop: 30s)


running (0m01.0s), 001/100 VUs, 0 complete and 0 interrupted iterations
default   [   0% ] 001/100 VUs  0m01.0s/3m30.0s

running (0m02.0s), 001/100 VUs, 0 complete and 0 interrupted iterations
default   [   1% ] 001/100 VUs  0m02.0s/3m30.0s

running (0m03.0s), 001/100 VUs, 0 complete and 0 interrupted iterations
default   [   1% ] 001/100 VUs  0m03.0s/3m30.0s

running (0m04.0s), 002/100 VUs, 0 complete and 0 interrupted iterations
default   [   2% ] 002/100 VUs  0m04.0s/3m30.0s

running (0m05.0s), 002/100 VUs, 0 complete and 0 interrupted iterations
default   [   2% ] 002/100 VUs  0m05.0s/3m30.0s

running (0m06.0s), 002/100 VUs, 1 complete and 0 interrupted iterations
default   [   3% ] 002/100 VUs  0m06.0s/3m30.0s

running (0m07.0s), 003/100 VUs, 1 complete and 0 interrupted iterations
default   [   3% ] 003/100 VUs  0m07.0s/3m30.0s

running (0m08.0s), 003/100 VUs, 1 complete and 0 interrupted iterations
default   [   4% ] 003/100 VUs  0m08.0s/3m30.0s

running (0m09.0s), 003/100 VUs, 1 complete and 0 interrupted iterations
default   [   4% ] 003/100 VUs  0m09.0s/3m30.0s

running (0m10.0s), 003/100 VUs, 2 complete and 0 interrupted iterations
default   [   5% ] 003/100 VUs  0m10.0s/3m30.0s

running (0m11.0s), 004/100 VUs, 2 complete and 0 interrupted iterations
default   [   5% ] 004/100 VUs  0m11.0s/3m30.0s

running (0m12.0s), 004/100 VUs, 3 complete and 0 interrupted iterations
default   [   6% ] 004/100 VUs  0m12.0s/3m30.0s

running (0m13.0s), 004/100 VUs, 4 complete and 0 interrupted iterations
default   [   6% ] 004/100 VUs  0m13.0s/3m30.0s

running (0m14.0s), 005/100 VUs, 4 complete and 0 interrupted iterations
default   [   7% ] 005/100 VUs  0m14.0s/3m30.0s

running (0m15.0s), 005/100 VUs, 5 complete and 0 interrupted iterations
default   [   7% ] 005/100 VUs  0m15.0s/3m30.0s

running (0m16.0s), 005/100 VUs, 6 complete and 0 interrupted iterations
default   [   8% ] 005/100 VUs  0m16.0s/3m30.0s

running (0m17.0s), 006/100 VUs, 7 complete and 0 interrupted iterations
default   [   8% ] 006/100 VUs  0m17.0s/3m30.0s

running (0m18.0s), 006/100 VUs, 8 complete and 0 interrupted iterations
default   [   9% ] 006/100 VUs  0m18.0s/3m30.0s

running (0m19.0s), 006/100 VUs, 9 complete and 0 interrupted iterations
default   [   9% ] 006/100 VUs  0m19.0s/3m30.0s

running (0m20.0s), 006/100 VUs, 9 complete and 0 interrupted iterations
default   [  10% ] 006/100 VUs  0m20.0s/3m30.0s

running (0m21.0s), 007/100 VUs, 10 complete and 0 interrupted iterations
default   [  10% ] 007/100 VUs  0m21.0s/3m30.0s

running (0m22.0s), 007/100 VUs, 11 complete and 0 interrupted iterations
default   [  10% ] 007/100 VUs  0m22.0s/3m30.0s

running (0m23.0s), 007/100 VUs, 13 complete and 0 interrupted iterations
default   [  11% ] 007/100 VUs  0m23.0s/3m30.0s

running (0m24.0s), 008/100 VUs, 14 complete and 0 interrupted iterations
default   [  11% ] 008/100 VUs  0m24.0s/3m30.0s

running (0m25.0s), 008/100 VUs, 15 complete and 0 interrupted iterations
default   [  12% ] 008/100 VUs  0m25.0s/3m30.0s

running (0m26.0s), 008/100 VUs, 17 complete and 0 interrupted iterations
default   [  12% ] 008/100 VUs  0m26.0s/3m30.0s

running (0m27.0s), 009/100 VUs, 18 complete and 0 interrupted iterations
default   [  13% ] 009/100 VUs  0m27.0s/3m30.0s

running (0m28.0s), 009/100 VUs, 19 complete and 0 interrupted iterations
default   [  13% ] 009/100 VUs  0m28.0s/3m30.0s

running (0m29.0s), 009/100 VUs, 21 complete and 0 interrupted iterations
default   [  14% ] 009/100 VUs  0m29.0s/3m30.0s

running (0m30.0s), 009/100 VUs, 22 complete and 0 interrupted iterations
default   [  14% ] 009/100 VUs  0m30.0s/3m30.0s

running (0m31.0s), 010/100 VUs, 23 complete and 0 interrupted iterations
default   [  15% ] 010/100 VUs  0m31.0s/3m30.0s

running (0m32.0s), 011/100 VUs, 25 complete and 0 interrupted iterations
default   [  15% ] 011/100 VUs  0m32.0s/3m30.0s

running (0m33.0s), 011/100 VUs, 27 complete and 0 interrupted iterations
default   [  16% ] 011/100 VUs  0m33.0s/3m30.0s

running (0m34.0s), 012/100 VUs, 29 complete and 0 interrupted iterations
default   [  16% ] 012/100 VUs  0m34.0s/3m30.0s

running (0m35.0s), 013/100 VUs, 31 complete and 0 interrupted iterations
default   [  17% ] 013/100 VUs  0m35.0s/3m30.0s

running (0m36.0s), 013/100 VUs, 33 complete and 0 interrupted iterations
default   [  17% ] 013/100 VUs  0m36.0s/3m30.0s

running (0m37.0s), 014/100 VUs, 34 complete and 0 interrupted iterations
default   [  18% ] 014/100 VUs  0m37.0s/3m30.0s

running (0m38.0s), 015/100 VUs, 37 complete and 0 interrupted iterations
default   [  18% ] 015/100 VUs  0m38.0s/3m30.0s

running (0m39.0s), 015/100 VUs, 39 complete and 0 interrupted iterations
default   [  19% ] 015/100 VUs  0m39.0s/3m30.0s

running (0m40.0s), 016/100 VUs, 41 complete and 0 interrupted iterations
default   [  19% ] 016/100 VUs  0m40.0s/3m30.0s

running (0m41.0s), 017/100 VUs, 44 complete and 0 interrupted iterations
default   [  20% ] 017/100 VUs  0m41.0s/3m30.0s

running (0m42.0s), 017/100 VUs, 47 complete and 0 interrupted iterations
default   [  20% ] 017/100 VUs  0m42.0s/3m30.0s

running (0m43.0s), 018/100 VUs, 50 complete and 0 interrupted iterations
default   [  20% ] 018/100 VUs  0m43.0s/3m30.0s

running (0m44.0s), 019/100 VUs, 53 complete and 0 interrupted iterations
default   [  21% ] 019/100 VUs  0m44.0s/3m30.0s

running (0m45.0s), 019/100 VUs, 57 complete and 0 interrupted iterations
default   [  21% ] 019/100 VUs  0m45.0s/3m30.0s

running (0m46.0s), 020/100 VUs, 60 complete and 0 interrupted iterations
default   [  22% ] 020/100 VUs  0m46.0s/3m30.0s

running (0m47.0s), 021/100 VUs, 62 complete and 0 interrupted iterations
default   [  22% ] 021/100 VUs  0m47.0s/3m30.0s

running (0m48.0s), 021/100 VUs, 65 complete and 0 interrupted iterations
default   [  23% ] 021/100 VUs  0m48.0s/3m30.0s

running (0m49.0s), 022/100 VUs, 69 complete and 0 interrupted iterations
default   [  23% ] 022/100 VUs  0m49.0s/3m30.0s

running (0m50.0s), 023/100 VUs, 73 complete and 0 interrupted iterations
default   [  24% ] 023/100 VUs  0m50.0s/3m30.0s

running (0m51.0s), 023/100 VUs, 77 complete and 0 interrupted iterations
default   [  24% ] 023/100 VUs  0m51.0s/3m30.0s

running (0m52.0s), 024/100 VUs, 81 complete and 0 interrupted iterations
default   [  25% ] 024/100 VUs  0m52.0s/3m30.0s

running (0m53.0s), 025/100 VUs, 85 complete and 0 interrupted iterations
default   [  25% ] 025/100 VUs  0m53.0s/3m30.0s

running (0m54.0s), 025/100 VUs, 90 complete and 0 interrupted iterations
default   [  26% ] 025/100 VUs  0m54.0s/3m30.0s

running (0m55.0s), 026/100 VUs, 94 complete and 0 interrupted iterations
default   [  26% ] 026/100 VUs  0m55.0s/3m30.0s

running (0m56.0s), 027/100 VUs, 98 complete and 0 interrupted iterations
default   [  27% ] 027/100 VUs  0m56.0s/3m30.0s

running (0m57.0s), 027/100 VUs, 103 complete and 0 interrupted iterations
default   [  27% ] 027/100 VUs  0m57.0s/3m30.0s

running (0m58.0s), 028/100 VUs, 106 complete and 0 interrupted iterations
default   [  28% ] 028/100 VUs  0m58.0s/3m30.0s

running (0m59.0s), 029/100 VUs, 111 complete and 0 interrupted iterations
default   [  28% ] 029/100 VUs  0m59.0s/3m30.0s

running (1m00.0s), 029/100 VUs, 117 complete and 0 interrupted iterations
default   [  29% ] 029/100 VUs  1m00.0s/3m30.0s

running (1m01.0s), 030/100 VUs, 121 complete and 0 interrupted iterations
default   [  29% ] 030/100 VUs  1m01.0s/3m30.0s

running (1m02.0s), 031/100 VUs, 127 complete and 0 interrupted iterations
default   [  30% ] 031/100 VUs  1m02.0s/3m30.0s

running (1m03.0s), 031/100 VUs, 133 complete and 0 interrupted iterations
default   [  30% ] 031/100 VUs  1m03.0s/3m30.0s

running (1m04.0s), 032/100 VUs, 138 complete and 0 interrupted iterations
default   [  30% ] 032/100 VUs  1m04.0s/3m30.0s

running (1m05.0s), 033/100 VUs, 142 complete and 0 interrupted iterations
default   [  31% ] 033/100 VUs  1m05.0s/3m30.0s

running (1m06.0s), 033/100 VUs, 149 complete and 0 interrupted iterations
default   [  31% ] 033/100 VUs  1m06.0s/3m30.0s

running (1m07.0s), 034/100 VUs, 153 complete and 0 interrupted iterations
default   [  32% ] 034/100 VUs  1m07.0s/3m30.0s

running (1m08.0s), 035/100 VUs, 159 complete and 0 interrupted iterations
default   [  32% ] 035/100 VUs  1m08.0s/3m30.0s

running (1m09.0s), 035/100 VUs, 166 complete and 0 interrupted iterations
default   [  33% ] 035/100 VUs  1m09.0s/3m30.0s

running (1m10.0s), 036/100 VUs, 171 complete and 0 interrupted iterations
default   [  33% ] 036/100 VUs  1m10.0s/3m30.0s

running (1m11.0s), 037/100 VUs, 178 complete and 0 interrupted iterations
default   [  34% ] 037/100 VUs  1m11.0s/3m30.0s

running (1m12.0s), 037/100 VUs, 185 complete and 0 interrupted iterations
default   [  34% ] 037/100 VUs  1m12.0s/3m30.0s

running (1m13.0s), 038/100 VUs, 192 complete and 0 interrupted iterations
default   [  35% ] 038/100 VUs  1m13.0s/3m30.0s

running (1m14.0s), 039/100 VUs, 199 complete and 0 interrupted iterations
default   [  35% ] 039/100 VUs  1m14.0s/3m30.0s

running (1m15.0s), 039/100 VUs, 205 complete and 0 interrupted iterations
default   [  36% ] 039/100 VUs  1m15.0s/3m30.0s

running (1m16.0s), 040/100 VUs, 209 complete and 0 interrupted iterations
default   [  36% ] 040/100 VUs  1m16.0s/3m30.0s

running (1m17.0s), 041/100 VUs, 217 complete and 0 interrupted iterations
default   [  37% ] 041/100 VUs  1m17.0s/3m30.0s

running (1m18.0s), 041/100 VUs, 225 complete and 0 interrupted iterations
default   [  37% ] 041/100 VUs  1m18.0s/3m30.0s

running (1m19.0s), 042/100 VUs, 231 complete and 0 interrupted iterations
default   [  38% ] 042/100 VUs  1m19.0s/3m30.0s

running (1m20.0s), 043/100 VUs, 239 complete and 0 interrupted iterations
default   [  38% ] 043/100 VUs  1m20.0s/3m30.0s

running (1m21.0s), 043/100 VUs, 247 complete and 0 interrupted iterations
default   [  39% ] 043/100 VUs  1m21.0s/3m30.0s

running (1m22.0s), 044/100 VUs, 255 complete and 0 interrupted iterations
default   [  39% ] 044/100 VUs  1m22.0s/3m30.0s

running (1m23.0s), 045/100 VUs, 262 complete and 0 interrupted iterations
default   [  40% ] 045/100 VUs  1m23.0s/3m30.0s

running (1m24.0s), 045/100 VUs, 270 complete and 0 interrupted iterations
default   [  40% ] 045/100 VUs  1m24.0s/3m30.0s

running (1m25.0s), 046/100 VUs, 278 complete and 0 interrupted iterations
default   [  40% ] 046/100 VUs  1m25.0s/3m30.0s

running (1m26.0s), 047/100 VUs, 284 complete and 0 interrupted iterations
default   [  41% ] 047/100 VUs  1m26.0s/3m30.0s

running (1m27.0s), 047/100 VUs, 293 complete and 0 interrupted iterations
default   [  41% ] 047/100 VUs  1m27.0s/3m30.0s

running (1m28.0s), 048/100 VUs, 300 complete and 0 interrupted iterations
default   [  42% ] 048/100 VUs  1m28.0s/3m30.0s

running (1m29.0s), 049/100 VUs, 309 complete and 0 interrupted iterations
default   [  42% ] 049/100 VUs  1m29.0s/3m30.0s

running (1m30.0s), 049/100 VUs, 319 complete and 0 interrupted iterations
default   [  43% ] 049/100 VUs  1m30.0s/3m30.0s

running (1m31.0s), 051/100 VUs, 328 complete and 0 interrupted iterations
default   [  43% ] 051/100 VUs  1m31.0s/3m30.0s

running (1m32.0s), 053/100 VUs, 337 complete and 0 interrupted iterations
default   [  44% ] 053/100 VUs  1m32.0s/3m30.0s

running (1m33.0s), 054/100 VUs, 346 complete and 0 interrupted iterations
default   [  44% ] 054/100 VUs  1m33.0s/3m30.0s

running (1m34.0s), 056/100 VUs, 355 complete and 0 interrupted iterations
default   [  45% ] 056/100 VUs  1m34.0s/3m30.0s

running (1m35.0s), 058/100 VUs, 361 complete and 0 interrupted iterations
default   [  45% ] 058/100 VUs  1m35.0s/3m30.0s

running (1m36.0s), 059/100 VUs, 371 complete and 0 interrupted iterations
default   [  46% ] 059/100 VUs  1m36.0s/3m30.0s

running (1m37.0s), 061/100 VUs, 381 complete and 0 interrupted iterations
default   [  46% ] 061/100 VUs  1m37.0s/3m30.0s

running (1m38.0s), 063/100 VUs, 392 complete and 0 interrupted iterations
default   [  47% ] 063/100 VUs  1m38.0s/3m30.0s

running (1m39.0s), 064/100 VUs, 403 complete and 0 interrupted iterations
default   [  47% ] 064/100 VUs  1m39.0s/3m30.0s

running (1m40.0s), 066/100 VUs, 415 complete and 0 interrupted iterations
default   [  48% ] 066/100 VUs  1m40.0s/3m30.0s

running (1m41.0s), 068/100 VUs, 427 complete and 0 interrupted iterations
default   [  48% ] 068/100 VUs  1m41.0s/3m30.0s

running (1m42.0s), 069/100 VUs, 438 complete and 0 interrupted iterations
default   [  49% ] 069/100 VUs  1m42.0s/3m30.0s

running (1m43.0s), 071/100 VUs, 451 complete and 0 interrupted iterations
default   [  49% ] 071/100 VUs  1m43.0s/3m30.0s

running (1m44.0s), 073/100 VUs, 462 complete and 0 interrupted iterations
default   [  50% ] 073/100 VUs  1m44.0s/3m30.0s

running (1m45.0s), 074/100 VUs, 472 complete and 0 interrupted iterations
default   [  50% ] 074/100 VUs  1m45.0s/3m30.0s

running (1m46.0s), 076/100 VUs, 486 complete and 0 interrupted iterations
default   [  50% ] 076/100 VUs  1m46.0s/3m30.0s

running (1m47.0s), 078/100 VUs, 497 complete and 0 interrupted iterations
default   [  51% ] 078/100 VUs  1m47.0s/3m30.0s

running (1m48.0s), 079/100 VUs, 512 complete and 0 interrupted iterations
default   [  51% ] 079/100 VUs  1m48.0s/3m30.0s

running (1m49.0s), 081/100 VUs, 526 complete and 0 interrupted iterations
default   [  52% ] 081/100 VUs  1m49.0s/3m30.0s

running (1m50.0s), 083/100 VUs, 541 complete and 0 interrupted iterations
default   [  52% ] 083/100 VUs  1m50.0s/3m30.0s

running (1m51.0s), 084/100 VUs, 554 complete and 0 interrupted iterations
default   [  53% ] 084/100 VUs  1m51.0s/3m30.0s

running (1m52.0s), 086/100 VUs, 568 complete and 0 interrupted iterations
default   [  53% ] 086/100 VUs  1m52.0s/3m30.0s

running (1m53.0s), 088/100 VUs, 582 complete and 0 interrupted iterations
default   [  54% ] 088/100 VUs  1m53.0s/3m30.0s

running (1m54.0s), 089/100 VUs, 596 complete and 0 interrupted iterations
default   [  54% ] 089/100 VUs  1m54.0s/3m30.0s

running (1m55.0s), 091/100 VUs, 613 complete and 0 interrupted iterations
default   [  55% ] 091/100 VUs  1m55.0s/3m30.0s

running (1m56.0s), 093/100 VUs, 629 complete and 0 interrupted iterations
default   [  55% ] 093/100 VUs  1m56.0s/3m30.0s

running (1m57.0s), 094/100 VUs, 643 complete and 0 interrupted iterations
default   [  56% ] 094/100 VUs  1m57.0s/3m30.0s

running (1m58.0s), 096/100 VUs, 661 complete and 0 interrupted iterations
default   [  56% ] 096/100 VUs  1m58.0s/3m30.0s

running (1m59.0s), 098/100 VUs, 679 complete and 0 interrupted iterations
default   [  57% ] 098/100 VUs  1m59.0s/3m30.0s

running (2m00.0s), 099/100 VUs, 695 complete and 0 interrupted iterations
default   [  57% ] 099/100 VUs  2m00.0s/3m30.0s

running (2m01.0s), 100/100 VUs, 714 complete and 0 interrupted iterations
default   [  58% ] 100/100 VUs  2m01.0s/3m30.0s

running (2m02.0s), 100/100 VUs, 731 complete and 0 interrupted iterations
default   [  58% ] 100/100 VUs  2m02.0s/3m30.0s

running (2m03.0s), 100/100 VUs, 744 complete and 0 interrupted iterations
default   [  59% ] 100/100 VUs  2m03.0s/3m30.0s

running (2m04.0s), 100/100 VUs, 763 complete and 0 interrupted iterations
default   [  59% ] 100/100 VUs  2m04.0s/3m30.0s

running (2m05.0s), 098/100 VUs, 783 complete and 0 interrupted iterations
default   [  60% ] 098/100 VUs  2m05.0s/3m30.0s

running (2m06.0s), 097/100 VUs, 803 complete and 0 interrupted iterations
default   [  60% ] 097/100 VUs  2m06.0s/3m30.0s

running (2m07.0s), 097/100 VUs, 818 complete and 0 interrupted iterations
default   [  60% ] 097/100 VUs  2m07.0s/3m30.0s

running (2m08.0s), 097/100 VUs, 836 complete and 0 interrupted iterations
default   [  61% ] 097/100 VUs  2m08.0s/3m30.0s

running (2m09.0s), 095/100 VUs, 855 complete and 0 interrupted iterations
default   [  61% ] 095/100 VUs  2m09.0s/3m30.0s

running (2m10.0s), 094/100 VUs, 872 complete and 0 interrupted iterations
default   [  62% ] 094/100 VUs  2m10.0s/3m30.0s

running (2m11.0s), 094/100 VUs, 891 complete and 0 interrupted iterations
default   [  62% ] 094/100 VUs  2m11.0s/3m30.0s

running (2m12.0s), 093/100 VUs, 910 complete and 0 interrupted iterations
default   [  63% ] 093/100 VUs  2m12.0s/3m30.0s

running (2m13.0s), 092/100 VUs, 921 complete and 0 interrupted iterations
default   [  63% ] 092/100 VUs  2m13.0s/3m30.0s

running (2m14.0s), 091/100 VUs, 939 complete and 0 interrupted iterations
default   [  64% ] 091/100 VUs  2m14.0s/3m30.0s

running (2m15.0s), 091/100 VUs, 956 complete and 0 interrupted iterations
default   [  64% ] 091/100 VUs  2m15.0s/3m30.0s

running (2m16.0s), 090/100 VUs, 972 complete and 0 interrupted iterations
default   [  65% ] 090/100 VUs  2m16.0s/3m30.0s

running (2m17.0s), 088/100 VUs, 989 complete and 0 interrupted iterations
default   [  65% ] 088/100 VUs  2m17.0s/3m30.0s

running (2m18.0s), 088/100 VUs, 1006 complete and 0 interrupted iterations
default   [  66% ] 088/100 VUs  2m18.0s/3m30.0s

running (2m19.0s), 088/100 VUs, 1023 complete and 0 interrupted iterations
default   [  66% ] 088/100 VUs  2m19.0s/3m30.0s

running (2m20.0s), 087/100 VUs, 1040 complete and 0 interrupted iterations
default   [  67% ] 087/100 VUs  2m20.0s/3m30.0s

running (2m21.0s), 085/100 VUs, 1056 complete and 0 interrupted iterations
default   [  67% ] 085/100 VUs  2m21.0s/3m30.0s

running (2m22.0s), 085/100 VUs, 1072 complete and 0 interrupted iterations
default   [  68% ] 085/100 VUs  2m22.0s/3m30.0s

running (2m23.0s), 085/100 VUs, 1083 complete and 0 interrupted iterations
default   [  68% ] 085/100 VUs  2m23.0s/3m30.0s

running (2m24.0s), 083/100 VUs, 1100 complete and 0 interrupted iterations
default   [  69% ] 083/100 VUs  2m24.0s/3m30.0s

running (2m25.0s), 082/100 VUs, 1117 complete and 0 interrupted iterations
default   [  69% ] 082/100 VUs  2m25.0s/3m30.0s

running (2m26.0s), 082/100 VUs, 1129 complete and 0 interrupted iterations
default   [  70% ] 082/100 VUs  2m26.0s/3m30.0s

running (2m27.0s), 080/100 VUs, 1147 complete and 0 interrupted iterations
default   [  70% ] 080/100 VUs  2m27.0s/3m30.0s

running (2m28.0s), 079/100 VUs, 1162 complete and 0 interrupted iterations
default   [  70% ] 079/100 VUs  2m28.0s/3m30.0s

running (2m29.0s), 078/100 VUs, 1176 complete and 0 interrupted iterations
default   [  71% ] 078/100 VUs  2m29.0s/3m30.0s

running (2m30.0s), 078/100 VUs, 1191 complete and 0 interrupted iterations
default   [  71% ] 078/100 VUs  2m30.0s/3m30.0s

running (2m31.0s), 076/100 VUs, 1205 complete and 0 interrupted iterations
default   [  72% ] 076/100 VUs  2m31.0s/3m30.0s

running (2m32.0s), 075/100 VUs, 1215 complete and 0 interrupted iterations
default   [  72% ] 075/100 VUs  2m32.0s/3m30.0s

running (2m33.0s), 075/100 VUs, 1230 complete and 0 interrupted iterations
default   [  73% ] 075/100 VUs  2m33.0s/3m30.0s

running (2m34.0s), 074/100 VUs, 1246 complete and 0 interrupted iterations
default   [  73% ] 074/100 VUs  2m34.0s/3m30.0s

running (2m35.0s), 073/100 VUs, 1257 complete and 0 interrupted iterations
default   [  74% ] 073/100 VUs  2m35.0s/3m30.0s

running (2m36.0s), 072/100 VUs, 1271 complete and 0 interrupted iterations
default   [  74% ] 072/100 VUs  2m36.0s/3m30.0s

running (2m37.0s), 072/100 VUs, 1286 complete and 0 interrupted iterations
default   [  75% ] 072/100 VUs  2m37.0s/3m30.0s

running (2m38.0s), 071/100 VUs, 1301 complete and 0 interrupted iterations
default   [  75% ] 071/100 VUs  2m38.0s/3m30.0s

running (2m39.0s), 069/100 VUs, 1314 complete and 0 interrupted iterations
default   [  76% ] 069/100 VUs  2m39.0s/3m30.0s

running (2m40.0s), 069/100 VUs, 1328 complete and 0 interrupted iterations
default   [  76% ] 069/100 VUs  2m40.0s/3m30.0s

running (2m41.0s), 069/100 VUs, 1338 complete and 0 interrupted iterations
default   [  77% ] 069/100 VUs  2m41.0s/3m30.0s

running (2m42.0s), 068/100 VUs, 1348 complete and 0 interrupted iterations
default   [  77% ] 068/100 VUs  2m42.0s/3m30.0s

running (2m43.0s), 066/100 VUs, 1362 complete and 0 interrupted iterations
default   [  78% ] 066/100 VUs  2m43.0s/3m30.0s

running (2m44.0s), 066/100 VUs, 1373 complete and 0 interrupted iterations
default   [  78% ] 066/100 VUs  2m44.0s/3m30.0s

running (2m45.0s), 066/100 VUs, 1385 complete and 0 interrupted iterations
default   [  79% ] 066/100 VUs  2m45.0s/3m30.0s

running (2m46.0s), 064/100 VUs, 1399 complete and 0 interrupted iterations
default   [  79% ] 064/100 VUs  2m46.0s/3m30.0s

running (2m47.0s), 063/100 VUs, 1412 complete and 0 interrupted iterations
default   [  80% ] 063/100 VUs  2m47.0s/3m30.0s

running (2m48.0s), 063/100 VUs, 1424 complete and 0 interrupted iterations
default   [  80% ] 063/100 VUs  2m48.0s/3m30.0s

running (2m49.0s), 063/100 VUs, 1435 complete and 0 interrupted iterations
default   [  80% ] 063/100 VUs  2m49.0s/3m30.0s

running (2m50.0s), 061/100 VUs, 1448 complete and 0 interrupted iterations
default   [  81% ] 061/100 VUs  2m50.0s/3m30.0s

running (2m51.0s), 060/100 VUs, 1455 complete and 0 interrupted iterations
default   [  81% ] 060/100 VUs  2m51.0s/3m30.0s

running (2m52.0s), 060/100 VUs, 1467 complete and 0 interrupted iterations
default   [  82% ] 060/100 VUs  2m52.0s/3m30.0s

running (2m53.0s), 059/100 VUs, 1479 complete and 0 interrupted iterations
default   [  82% ] 059/100 VUs  2m53.0s/3m30.0s

running (2m54.0s), 058/100 VUs, 1488 complete and 0 interrupted iterations
default   [  83% ] 058/100 VUs  2m54.0s/3m30.0s

running (2m55.0s), 057/100 VUs, 1501 complete and 0 interrupted iterations
default   [  83% ] 057/100 VUs  2m55.0s/3m30.0s

running (2m56.0s), 057/100 VUs, 1511 complete and 0 interrupted iterations
default   [  84% ] 057/100 VUs  2m56.0s/3m30.0s

running (2m57.0s), 056/100 VUs, 1522 complete and 0 interrupted iterations
default   [  84% ] 056/100 VUs  2m57.0s/3m30.0s

running (2m58.0s), 054/100 VUs, 1535 complete and 0 interrupted iterations
default   [  85% ] 054/100 VUs  2m58.0s/3m30.0s

running (2m59.0s), 054/100 VUs, 1545 complete and 0 interrupted iterations
default   [  85% ] 054/100 VUs  2m59.0s/3m30.0s

running (3m00.0s), 054/100 VUs, 1548 complete and 0 interrupted iterations
default   [  86% ] 054/100 VUs  3m00.0s/3m30.0s

running (3m01.0s), 053/100 VUs, 1564 complete and 0 interrupted iterations
default   [  86% ] 053/100 VUs  3m01.0s/3m30.0s

running (3m02.0s), 050/100 VUs, 1572 complete and 0 interrupted iterations
default   [  87% ] 050/100 VUs  3m02.0s/3m30.0s

running (3m03.0s), 050/100 VUs, 1579 complete and 0 interrupted iterations
default   [  87% ] 050/100 VUs  3m03.0s/3m30.0s

running (3m04.0s), 049/100 VUs, 1589 complete and 0 interrupted iterations
default   [  88% ] 049/100 VUs  3m04.0s/3m30.0s

running (3m05.0s), 048/100 VUs, 1599 complete and 0 interrupted iterations
default   [  88% ] 048/100 VUs  3m05.0s/3m30.0s

running (3m06.0s), 044/100 VUs, 1611 complete and 0 interrupted iterations
default   [  89% ] 044/100 VUs  3m06.0s/3m30.0s

running (3m07.0s), 044/100 VUs, 1619 complete and 0 interrupted iterations
default   [  89% ] 044/100 VUs  3m07.0s/3m30.0s

running (3m08.0s), 043/100 VUs, 1628 complete and 0 interrupted iterations
default   [  90% ] 043/100 VUs  3m08.0s/3m30.0s

running (3m09.0s), 041/100 VUs, 1632 complete and 0 interrupted iterations
default   [  90% ] 041/100 VUs  3m09.0s/3m30.0s

running (3m10.0s), 039/100 VUs, 1641 complete and 0 interrupted iterations
default   [  90% ] 039/100 VUs  3m10.0s/3m30.0s

running (3m11.0s), 038/100 VUs, 1648 complete and 0 interrupted iterations
default   [  91% ] 038/100 VUs  3m11.0s/3m30.0s

running (3m12.0s), 036/100 VUs, 1655 complete and 0 interrupted iterations
default   [  91% ] 036/100 VUs  3m12.0s/3m30.0s

running (3m13.0s), 034/100 VUs, 1663 complete and 0 interrupted iterations
default   [  92% ] 034/100 VUs  3m13.0s/3m30.0s

running (3m14.0s), 032/100 VUs, 1671 complete and 0 interrupted iterations
default   [  92% ] 032/100 VUs  3m14.0s/3m30.0s

running (3m15.0s), 030/100 VUs, 1678 complete and 0 interrupted iterations
default   [  93% ] 030/100 VUs  3m15.0s/3m30.0s

running (3m16.0s), 028/100 VUs, 1685 complete and 0 interrupted iterations
default   [  93% ] 028/100 VUs  3m16.0s/3m30.0s

running (3m17.0s), 026/100 VUs, 1691 complete and 0 interrupted iterations
default   [  94% ] 026/100 VUs  3m17.0s/3m30.0s

running (3m18.0s), 024/100 VUs, 1697 complete and 0 interrupted iterations
default   [  94% ] 024/100 VUs  3m18.0s/3m30.0s

running (3m19.0s), 024/100 VUs, 1698 complete and 0 interrupted iterations
default   [  95% ] 024/100 VUs  3m19.0s/3m30.0s

running (3m20.0s), 022/100 VUs, 1704 complete and 0 interrupted iterations
default   [  95% ] 022/100 VUs  3m20.0s/3m30.0s

running (3m21.0s), 020/100 VUs, 1709 complete and 0 interrupted iterations
default   [  96% ] 020/100 VUs  3m21.0s/3m30.0s

running (3m22.0s), 018/100 VUs, 1713 complete and 0 interrupted iterations
default   [  96% ] 018/100 VUs  3m22.0s/3m30.0s

running (3m23.0s), 017/100 VUs, 1717 complete and 0 interrupted iterations
default   [  97% ] 017/100 VUs  3m23.0s/3m30.0s

running (3m24.0s), 015/100 VUs, 1721 complete and 0 interrupted iterations
default   [  97% ] 015/100 VUs  3m24.0s/3m30.0s

running (3m25.0s), 013/100 VUs, 1725 complete and 0 interrupted iterations
default   [  98% ] 013/100 VUs  3m25.0s/3m30.0s

running (3m26.0s), 011/100 VUs, 1728 complete and 0 interrupted iterations
default   [  98% ] 011/100 VUs  3m26.0s/3m30.0s

running (3m27.0s), 010/100 VUs, 1731 complete and 0 interrupted iterations
default   [  99% ] 010/100 VUs  3m27.0s/3m30.0s

running (3m28.0s), 008/100 VUs, 1734 complete and 0 interrupted iterations
default   [  99% ] 008/100 VUs  3m28.0s/3m30.0s

running (3m29.0s), 006/100 VUs, 1736 complete and 0 interrupted iterations
default   [ 100% ] 006/100 VUs  3m29.0s/3m30.0s

running (3m30.0s), 006/100 VUs, 1736 complete and 0 interrupted iterations
default   [ 100% ] 006/100 VUs  3m30.0s/3m30.0s

running (3m31.0s), 004/100 VUs, 1738 complete and 0 interrupted iterations
default ↓ [ 100% ] 006/100 VUs  3m30s

running (3m32.0s), 003/100 VUs, 1739 complete and 0 interrupted iterations
default ↓ [ 100% ] 006/100 VUs  3m30s

running (3m33.0s), 001/100 VUs, 1741 complete and 0 interrupted iterations
default ↓ [ 100% ] 006/100 VUs  3m30s


  █ THRESHOLDS 

    errors
    ✓ 'rate<0.1' rate=0.00%

    http_req_duration
    ✓ 'p(95)<500' p(95)=71.74ms


  █ TOTAL RESULTS 

    checks_total.......: 20904   97.884076/s
    checks_succeeded...: 100.00% 20904 out of 20904
    checks_failed......: 0.00%   0 out of 20904

    ✓ registration status is 201/409
    ✓ login status is 200/201
    ✓ /faculties status 200
    ✓ /faculties < 500ms
    ✓ /categories status 200
    ✓ /categories < 500ms
    ✓ /questions status 200
    ✓ /questions < 500ms
    ✓ /answers status 200
    ✓ /answers < 500ms
    ✓ profiles status 200
    ✓ profile by id 200

    CUSTOM
    errors.........................: 0.00%  0 out of 0

    HTTP
    http_req_duration..............: avg=10.3ms  min=345µs med=1.56ms max=113.82ms p(90)=56.24ms p(95)=71.74ms
      { expected_response:true }...: avg=11.48ms min=345µs med=1.55ms max=113.82ms p(90)=58.91ms p(95)=75.34ms
    http_req_failed................: 12.42% 1732 out of 13936
    http_reqs......................: 13936  65.256051/s

    EXECUTION
    iteration_duration.............: avg=5.58s   min=5.55s med=5.58s  max=5.68s    p(90)=5.61s   p(95)=5.61s  
    iterations.....................: 1742   8.157006/s
    vus............................: 1      min=1             max=100
    vus_max........................: 100    min=100           max=100

    NETWORK
    data_received..................: 12 MB  57 kB/s
    data_sent......................: 4.6 MB 21 kB/s




running (3m33.6s), 000/100 VUs, 1742 complete and 0 interrupted iterations
default ✓ [ 100% ] 000/100 VUs  3m30s
