
         /\      Grafana   /‾‾/  
    /\  /  \     |\  __   /  /   
   /  \/    \    | |/ /  /   ‾‾\ 
  /          \   |   (  |  (‾)  |
 / __________ \  |_|\_\  \_____/ 

     execution: local
        script: load-tests/k6-load-test.js
        output: -

     scenarios: (100.00%) 1 scenario, 100 max VUs, 4m0s max duration (incl. graceful stop):
              * default: Up to 100 looping VUs for 3m30s over 5 stages (gracefulRampDown: 30s, gracefulStop: 30s)


running (0m01.0s), 001/100 VUs, 0 complete and 0 interrupted iterations
default   [   0% ] 001/100 VUs  0m00.7s/3m30.0s

running (0m02.0s), 001/100 VUs, 1 complete and 0 interrupted iterations
default   [   1% ] 001/100 VUs  0m01.7s/3m30.0s

running (0m03.0s), 001/100 VUs, 1 complete and 0 interrupted iterations
default   [   1% ] 001/100 VUs  0m02.7s/3m30.0s

running (0m04.0s), 002/100 VUs, 2 complete and 0 interrupted iterations
default   [   2% ] 002/100 VUs  0m03.7s/3m30.0s

running (0m05.0s), 002/100 VUs, 3 complete and 0 interrupted iterations
default   [   2% ] 002/100 VUs  0m04.7s/3m30.0s

running (0m06.0s), 002/100 VUs, 5 complete and 0 interrupted iterations
default   [   3% ] 002/100 VUs  0m05.7s/3m30.0s

running (0m07.0s), 003/100 VUs, 6 complete and 0 interrupted iterations
default   [   3% ] 003/100 VUs  0m06.7s/3m30.0s

running (0m08.0s), 003/100 VUs, 8 complete and 0 interrupted iterations
default   [   4% ] 003/100 VUs  0m07.7s/3m30.0s

running (0m09.0s), 003/100 VUs, 10 complete and 0 interrupted iterations
default   [   4% ] 003/100 VUs  0m08.7s/3m30.0s

running (0m10.0s), 003/100 VUs, 13 complete and 0 interrupted iterations
default   [   5% ] 003/100 VUs  0m09.7s/3m30.0s

running (0m11.0s), 004/100 VUs, 14 complete and 0 interrupted iterations
default   [   5% ] 004/100 VUs  0m10.7s/3m30.0s

running (0m12.0s), 004/100 VUs, 18 complete and 0 interrupted iterations
default   [   6% ] 004/100 VUs  0m11.7s/3m30.0s

running (0m13.0s), 004/100 VUs, 20 complete and 0 interrupted iterations
default   [   6% ] 004/100 VUs  0m12.7s/3m30.0s

running (0m14.0s), 005/100 VUs, 24 complete and 0 interrupted iterations
default   [   7% ] 005/100 VUs  0m13.7s/3m30.0s

running (0m15.0s), 005/100 VUs, 26 complete and 0 interrupted iterations
default   [   7% ] 005/100 VUs  0m14.7s/3m30.0s

running (0m16.0s), 005/100 VUs, 31 complete and 0 interrupted iterations
default   [   7% ] 005/100 VUs  0m15.7s/3m30.0s

running (0m17.0s), 006/100 VUs, 34 complete and 0 interrupted iterations
default   [   8% ] 006/100 VUs  0m16.7s/3m30.0s

running (0m18.0s), 006/100 VUs, 39 complete and 0 interrupted iterations
default   [   8% ] 006/100 VUs  0m17.7s/3m30.0s

running (0m19.0s), 006/100 VUs, 42 complete and 0 interrupted iterations
default   [   9% ] 006/100 VUs  0m18.7s/3m30.0s

running (0m20.0s), 006/100 VUs, 48 complete and 0 interrupted iterations
default   [   9% ] 006/100 VUs  0m19.7s/3m30.0s

running (0m21.0s), 007/100 VUs, 51 complete and 0 interrupted iterations
default   [  10% ] 007/100 VUs  0m20.7s/3m30.0s

running (0m22.0s), 007/100 VUs, 58 complete and 0 interrupted iterations
default   [  10% ] 007/100 VUs  0m21.7s/3m30.0s

running (0m23.0s), 007/100 VUs, 61 complete and 0 interrupted iterations
default   [  11% ] 007/100 VUs  0m22.7s/3m30.0s

running (0m24.0s), 008/100 VUs, 68 complete and 0 interrupted iterations
default   [  11% ] 008/100 VUs  0m23.7s/3m30.0s

running (0m25.0s), 008/100 VUs, 72 complete and 0 interrupted iterations
default   [  12% ] 008/100 VUs  0m24.7s/3m30.0s

running (0m26.0s), 008/100 VUs, 80 complete and 0 interrupted iterations
default   [  12% ] 008/100 VUs  0m25.7s/3m30.0s

running (0m27.0s), 009/100 VUs, 84 complete and 0 interrupted iterations
default   [  13% ] 009/100 VUs  0m26.7s/3m30.0s

running (0m28.0s), 009/100 VUs, 92 complete and 0 interrupted iterations
default   [  13% ] 009/100 VUs  0m27.7s/3m30.0s

running (0m29.0s), 009/100 VUs, 97 complete and 0 interrupted iterations
default   [  14% ] 009/100 VUs  0m28.7s/3m30.0s

running (0m30.0s), 009/100 VUs, 106 complete and 0 interrupted iterations
default   [  14% ] 009/100 VUs  0m29.7s/3m30.0s

running (0m31.0s), 010/100 VUs, 110 complete and 0 interrupted iterations
default   [  15% ] 010/100 VUs  0m30.7s/3m30.0s

running (0m32.0s), 011/100 VUs, 120 complete and 0 interrupted iterations
default   [  15% ] 011/100 VUs  0m31.7s/3m30.0s

running (0m33.0s), 011/100 VUs, 127 complete and 0 interrupted iterations
default   [  16% ] 011/100 VUs  0m32.7s/3m30.0s

running (0m34.0s), 012/100 VUs, 136 complete and 0 interrupted iterations
default   [  16% ] 012/100 VUs  0m33.7s/3m30.0s

running (0m35.0s), 013/100 VUs, 145 complete and 0 interrupted iterations
default   [  17% ] 013/100 VUs  0m34.7s/3m30.0s

running (0m36.0s), 013/100 VUs, 154 complete and 0 interrupted iterations
default   [  17% ] 013/100 VUs  0m35.7s/3m30.0s

running (0m37.0s), 014/100 VUs, 164 complete and 0 interrupted iterations
default   [  17% ] 014/100 VUs  0m36.7s/3m30.0s

running (0m38.0s), 015/100 VUs, 175 complete and 0 interrupted iterations
default   [  18% ] 015/100 VUs  0m37.7s/3m30.0s

running (0m39.0s), 015/100 VUs, 185 complete and 0 interrupted iterations
default   [  18% ] 015/100 VUs  0m38.7s/3m30.0s

running (0m40.0s), 016/100 VUs, 196 complete and 0 interrupted iterations
default   [  19% ] 016/100 VUs  0m39.7s/3m30.0s

running (0m41.0s), 017/100 VUs, 209 complete and 0 interrupted iterations
default   [  19% ] 017/100 VUs  0m40.7s/3m30.0s

running (0m42.0s), 017/100 VUs, 221 complete and 0 interrupted iterations
default   [  20% ] 017/100 VUs  0m41.7s/3m30.0s

running (0m43.0s), 018/100 VUs, 235 complete and 0 interrupted iterations
default   [  20% ] 018/100 VUs  0m42.7s/3m30.0s

running (0m44.0s), 019/100 VUs, 247 complete and 0 interrupted iterations
default   [  21% ] 019/100 VUs  0m43.7s/3m30.0s

running (0m45.0s), 019/100 VUs, 263 complete and 0 interrupted iterations
default   [  21% ] 019/100 VUs  0m44.7s/3m30.0s

running (0m46.0s), 020/100 VUs, 275 complete and 0 interrupted iterations
default   [  22% ] 020/100 VUs  0m45.7s/3m30.0s

running (0m47.0s), 021/100 VUs, 292 complete and 0 interrupted iterations
default   [  22% ] 021/100 VUs  0m46.7s/3m30.0s

running (0m48.0s), 021/100 VUs, 305 complete and 0 interrupted iterations
default   [  23% ] 021/100 VUs  0m47.7s/3m30.0s

running (0m49.0s), 022/100 VUs, 323 complete and 0 interrupted iterations
default   [  23% ] 022/100 VUs  0m48.7s/3m30.0s

running (0m50.0s), 023/100 VUs, 338 complete and 0 interrupted iterations
default   [  24% ] 023/100 VUs  0m49.7s/3m30.0s

running (0m51.0s), 023/100 VUs, 358 complete and 0 interrupted iterations
default   [  24% ] 023/100 VUs  0m50.7s/3m30.0s

running (0m52.0s), 024/100 VUs, 372 complete and 0 interrupted iterations
default   [  25% ] 024/100 VUs  0m51.7s/3m30.0s

running (0m53.0s), 025/100 VUs, 393 complete and 0 interrupted iterations
default   [  25% ] 025/100 VUs  0m52.7s/3m30.0s

running (0m54.0s), 025/100 VUs, 409 complete and 0 interrupted iterations
default   [  26% ] 025/100 VUs  0m53.7s/3m30.0s

running (0m55.0s), 026/100 VUs, 431 complete and 0 interrupted iterations
default   [  26% ] 026/100 VUs  0m54.7s/3m30.0s

running (0m56.0s), 027/100 VUs, 448 complete and 0 interrupted iterations
default   [  27% ] 027/100 VUs  0m55.7s/3m30.0s

running (0m57.0s), 027/100 VUs, 469 complete and 0 interrupted iterations
default   [  27% ] 027/100 VUs  0m56.7s/3m30.0s

running (0m58.0s), 028/100 VUs, 488 complete and 0 interrupted iterations
default   [  27% ] 028/100 VUs  0m57.7s/3m30.0s

running (0m59.0s), 029/100 VUs, 512 complete and 0 interrupted iterations
default   [  28% ] 029/100 VUs  0m58.7s/3m30.0s

running (1m00.0s), 029/100 VUs, 530 complete and 0 interrupted iterations
default   [  28% ] 029/100 VUs  0m59.7s/3m30.0s

running (1m01.0s), 030/100 VUs, 553 complete and 0 interrupted iterations
default   [  29% ] 030/100 VUs  1m00.7s/3m30.0s

running (1m02.0s), 031/100 VUs, 575 complete and 0 interrupted iterations
default   [  29% ] 031/100 VUs  1m01.7s/3m30.0s

running (1m03.0s), 031/100 VUs, 600 complete and 0 interrupted iterations
default   [  30% ] 031/100 VUs  1m02.7s/3m30.0s

running (1m04.0s), 032/100 VUs, 621 complete and 0 interrupted iterations
default   [  30% ] 032/100 VUs  1m03.7s/3m30.0s

running (1m05.0s), 033/100 VUs, 647 complete and 0 interrupted iterations
default   [  31% ] 033/100 VUs  1m04.7s/3m30.0s

running (1m06.0s), 033/100 VUs, 669 complete and 0 interrupted iterations
default   [  31% ] 033/100 VUs  1m05.7s/3m30.0s

running (1m07.0s), 034/100 VUs, 696 complete and 0 interrupted iterations
default   [  32% ] 034/100 VUs  1m06.7s/3m30.0s

running (1m08.0s), 035/100 VUs, 721 complete and 0 interrupted iterations
default   [  32% ] 035/100 VUs  1m07.7s/3m30.0s

running (1m09.0s), 035/100 VUs, 748 complete and 0 interrupted iterations
default   [  33% ] 035/100 VUs  1m08.7s/3m30.0s

running (1m10.0s), 036/100 VUs, 771 complete and 0 interrupted iterations
default   [  33% ] 036/100 VUs  1m09.7s/3m30.0s

running (1m11.0s), 037/100 VUs, 802 complete and 0 interrupted iterations
default   [  34% ] 037/100 VUs  1m10.7s/3m30.0s

running (1m12.0s), 037/100 VUs, 827 complete and 0 interrupted iterations
default   [  34% ] 037/100 VUs  1m11.7s/3m30.0s

running (1m13.0s), 038/100 VUs, 857 complete and 0 interrupted iterations
default   [  35% ] 038/100 VUs  1m12.7s/3m30.0s

running (1m14.0s), 039/100 VUs, 884 complete and 0 interrupted iterations
default   [  35% ] 039/100 VUs  1m13.7s/3m30.0s

running (1m15.0s), 039/100 VUs, 914 complete and 0 interrupted iterations
default   [  36% ] 039/100 VUs  1m14.7s/3m30.0s

running (1m16.0s), 040/100 VUs, 942 complete and 0 interrupted iterations
default   [  36% ] 040/100 VUs  1m15.7s/3m30.0s

running (1m17.0s), 041/100 VUs, 975 complete and 0 interrupted iterations
default   [  37% ] 041/100 VUs  1m16.7s/3m30.0s

running (1m18.0s), 041/100 VUs, 1002 complete and 0 interrupted iterations
default   [  37% ] 041/100 VUs  1m17.7s/3m30.0s

running (1m19.0s), 042/100 VUs, 1036 complete and 0 interrupted iterations
default   [  37% ] 042/100 VUs  1m18.7s/3m30.0s

running (1m20.0s), 043/100 VUs, 1066 complete and 0 interrupted iterations
default   [  38% ] 043/100 VUs  1m19.7s/3m30.0s

running (1m21.0s), 043/100 VUs, 1100 complete and 0 interrupted iterations
default   [  38% ] 043/100 VUs  1m20.7s/3m30.0s

running (1m22.0s), 044/100 VUs, 1128 complete and 0 interrupted iterations
default   [  39% ] 044/100 VUs  1m21.7s/3m30.0s

running (1m23.0s), 045/100 VUs, 1166 complete and 0 interrupted iterations
default   [  39% ] 045/100 VUs  1m22.7s/3m30.0s

running (1m24.0s), 045/100 VUs, 1196 complete and 0 interrupted iterations
default   [  40% ] 045/100 VUs  1m23.7s/3m30.0s

running (1m25.0s), 046/100 VUs, 1233 complete and 0 interrupted iterations
default   [  40% ] 046/100 VUs  1m24.7s/3m30.0s

running (1m26.0s), 047/100 VUs, 1264 complete and 0 interrupted iterations
default   [  41% ] 047/100 VUs  1m25.7s/3m30.0s

running (1m27.0s), 047/100 VUs, 1303 complete and 0 interrupted iterations
default   [  41% ] 047/100 VUs  1m26.7s/3m30.0s

running (1m28.0s), 048/100 VUs, 1336 complete and 0 interrupted iterations
default   [  42% ] 048/100 VUs  1m27.7s/3m30.0s

running (1m29.0s), 049/100 VUs, 1374 complete and 0 interrupted iterations
default   [  42% ] 049/100 VUs  1m28.7s/3m30.0s

running (1m30.0s), 049/100 VUs, 1406 complete and 0 interrupted iterations
default   [  43% ] 049/100 VUs  1m29.7s/3m30.0s

running (1m31.0s), 051/100 VUs, 1448 complete and 0 interrupted iterations
default   [  43% ] 051/100 VUs  1m30.7s/3m30.0s

running (1m32.0s), 052/100 VUs, 1483 complete and 0 interrupted iterations
default   [  44% ] 052/100 VUs  1m31.7s/3m30.0s

running (1m33.0s), 054/100 VUs, 1526 complete and 0 interrupted iterations
default   [  44% ] 054/100 VUs  1m32.7s/3m30.0s

running (1m34.0s), 056/100 VUs, 1568 complete and 0 interrupted iterations
default   [  45% ] 056/100 VUs  1m33.7s/3m30.0s

running (1m35.0s), 057/100 VUs, 1607 complete and 0 interrupted iterations
default   [  45% ] 057/100 VUs  1m34.7s/3m30.0s

running (1m36.0s), 059/100 VUs, 1654 complete and 0 interrupted iterations
default   [  46% ] 059/100 VUs  1m35.7s/3m30.0s

running (1m37.0s), 061/100 VUs, 1695 complete and 0 interrupted iterations
default   [  46% ] 061/100 VUs  1m36.7s/3m30.0s

running (1m38.0s), 062/100 VUs, 1744 complete and 0 interrupted iterations
default   [  47% ] 062/100 VUs  1m37.7s/3m30.0s

running (1m39.0s), 064/100 VUs, 1784 complete and 0 interrupted iterations
default   [  47% ] 064/100 VUs  1m38.7s/3m30.0s

running (1m40.0s), 066/100 VUs, 1838 complete and 0 interrupted iterations
default   [  47% ] 066/100 VUs  1m39.7s/3m30.0s

running (1m41.0s), 067/100 VUs, 1884 complete and 0 interrupted iterations
default   [  48% ] 067/100 VUs  1m40.7s/3m30.0s

running (1m42.0s), 069/100 VUs, 1937 complete and 0 interrupted iterations
default   [  48% ] 069/100 VUs  1m41.7s/3m30.0s

running (1m43.0s), 071/100 VUs, 1987 complete and 0 interrupted iterations
default   [  49% ] 071/100 VUs  1m42.7s/3m30.0s

running (1m44.0s), 072/100 VUs, 2042 complete and 0 interrupted iterations
default   [  49% ] 072/100 VUs  1m43.7s/3m30.0s

running (1m45.0s), 074/100 VUs, 2097 complete and 0 interrupted iterations
default   [  50% ] 074/100 VUs  1m44.7s/3m30.0s

running (1m46.0s), 076/100 VUs, 2151 complete and 0 interrupted iterations
default   [  50% ] 076/100 VUs  1m45.7s/3m30.0s

running (1m47.0s), 077/100 VUs, 2206 complete and 0 interrupted iterations
default   [  51% ] 077/100 VUs  1m46.7s/3m30.0s

running (1m48.0s), 079/100 VUs, 2265 complete and 0 interrupted iterations
default   [  51% ] 079/100 VUs  1m47.7s/3m30.0s

running (1m49.0s), 081/100 VUs, 2326 complete and 0 interrupted iterations
default   [  52% ] 081/100 VUs  1m48.7s/3m30.0s

running (1m50.0s), 082/100 VUs, 2388 complete and 0 interrupted iterations
default   [  52% ] 082/100 VUs  1m49.7s/3m30.0s

running (1m51.0s), 084/100 VUs, 2448 complete and 0 interrupted iterations
default   [  53% ] 084/100 VUs  1m50.7s/3m30.0s

running (1m52.0s), 086/100 VUs, 2516 complete and 0 interrupted iterations
default   [  53% ] 086/100 VUs  1m51.7s/3m30.0s

running (1m53.0s), 087/100 VUs, 2575 complete and 0 interrupted iterations
default   [  54% ] 087/100 VUs  1m52.7s/3m30.0s

running (1m54.0s), 089/100 VUs, 2649 complete and 0 interrupted iterations
default   [  54% ] 089/100 VUs  1m53.7s/3m30.0s

running (1m55.0s), 091/100 VUs, 2707 complete and 0 interrupted iterations
default   [  55% ] 091/100 VUs  1m54.7s/3m30.0s

running (1m56.0s), 092/100 VUs, 2782 complete and 0 interrupted iterations
default   [  55% ] 092/100 VUs  1m55.7s/3m30.0s

running (1m57.0s), 094/100 VUs, 2848 complete and 0 interrupted iterations
default   [  56% ] 094/100 VUs  1m56.7s/3m30.0s

running (1m58.0s), 096/100 VUs, 2922 complete and 0 interrupted iterations
default   [  56% ] 096/100 VUs  1m57.7s/3m30.0s

running (1m59.0s), 097/100 VUs, 2986 complete and 0 interrupted iterations
default   [  57% ] 097/100 VUs  1m58.7s/3m30.0s

running (2m00.0s), 099/100 VUs, 3069 complete and 0 interrupted iterations
default   [  57% ] 099/100 VUs  1m59.7s/3m30.0s

running (2m01.0s), 100/100 VUs, 3137 complete and 0 interrupted iterations
default   [  57% ] 100/100 VUs  2m00.7s/3m30.0s

running (2m02.0s), 099/100 VUs, 3216 complete and 0 interrupted iterations
default   [  58% ] 099/100 VUs  2m01.7s/3m30.0s

running (2m03.0s), 099/100 VUs, 3282 complete and 0 interrupted iterations
default   [  58% ] 099/100 VUs  2m02.7s/3m30.0s

running (2m04.0s), 098/100 VUs, 3367 complete and 0 interrupted iterations
default   [  59% ] 098/100 VUs  2m03.7s/3m30.0s

running (2m05.0s), 097/100 VUs, 3446 complete and 0 interrupted iterations
default   [  59% ] 097/100 VUs  2m04.7s/3m30.0s

running (2m06.0s), 096/100 VUs, 3511 complete and 0 interrupted iterations
default   [  60% ] 096/100 VUs  2m05.7s/3m30.0s

running (2m07.0s), 096/100 VUs, 3575 complete and 0 interrupted iterations
default   [  60% ] 096/100 VUs  2m06.7s/3m30.0s

running (2m08.0s), 094/100 VUs, 3657 complete and 0 interrupted iterations
default   [  61% ] 094/100 VUs  2m07.7s/3m30.0s

running (2m09.0s), 093/100 VUs, 3737 complete and 0 interrupted iterations
default   [  61% ] 093/100 VUs  2m08.7s/3m30.0s

running (2m10.0s), 093/100 VUs, 3796 complete and 0 interrupted iterations
default   [  62% ] 093/100 VUs  2m09.7s/3m30.0s

running (2m11.0s), 092/100 VUs, 3858 complete and 0 interrupted iterations
default   [  62% ] 092/100 VUs  2m10.7s/3m30.0s

running (2m12.0s), 091/100 VUs, 3937 complete and 0 interrupted iterations
default   [  63% ] 091/100 VUs  2m11.7s/3m30.0s

running (2m13.0s), 091/100 VUs, 4014 complete and 0 interrupted iterations
default   [  63% ] 091/100 VUs  2m12.7s/3m30.0s

running (2m14.0s), 090/100 VUs, 4072 complete and 0 interrupted iterations
default   [  64% ] 090/100 VUs  2m13.7s/3m30.0s

running (2m15.0s), 089/100 VUs, 4131 complete and 0 interrupted iterations
default   [  64% ] 089/100 VUs  2m14.7s/3m30.0s

running (2m16.0s), 088/100 VUs, 4208 complete and 0 interrupted iterations
default   [  65% ] 088/100 VUs  2m15.7s/3m30.0s

running (2m17.0s), 087/100 VUs, 4282 complete and 0 interrupted iterations
default   [  65% ] 087/100 VUs  2m16.7s/3m30.0s

running (2m18.0s), 086/100 VUs, 4338 complete and 0 interrupted iterations
default   [  66% ] 086/100 VUs  2m17.7s/3m30.0s

running (2m19.0s), 085/100 VUs, 4395 complete and 0 interrupted iterations
default   [  66% ] 085/100 VUs  2m18.7s/3m30.0s

running (2m20.0s), 085/100 VUs, 4468 complete and 0 interrupted iterations
default   [  67% ] 085/100 VUs  2m19.7s/3m30.0s

running (2m21.0s), 084/100 VUs, 4522 complete and 0 interrupted iterations
default   [  67% ] 084/100 VUs  2m20.7s/3m30.0s

running (2m22.0s), 083/100 VUs, 4593 complete and 0 interrupted iterations
default   [  67% ] 083/100 VUs  2m21.7s/3m30.0s

running (2m23.0s), 082/100 VUs, 4648 complete and 0 interrupted iterations
default   [  68% ] 082/100 VUs  2m22.7s/3m30.0s

running (2m24.0s), 082/100 VUs, 4718 complete and 0 interrupted iterations
default   [  68% ] 082/100 VUs  2m23.7s/3m30.0s

running (2m25.0s), 080/100 VUs, 4770 complete and 0 interrupted iterations
default   [  69% ] 080/100 VUs  2m24.7s/3m30.0s

running (2m26.0s), 079/100 VUs, 4839 complete and 0 interrupted iterations
default   [  69% ] 079/100 VUs  2m25.7s/3m30.0s

running (2m27.0s), 079/100 VUs, 4890 complete and 0 interrupted iterations
default   [  70% ] 079/100 VUs  2m26.7s/3m30.0s

running (2m28.0s), 078/100 VUs, 4959 complete and 0 interrupted iterations
default   [  70% ] 078/100 VUs  2m27.7s/3m30.0s

running (2m29.0s), 077/100 VUs, 5008 complete and 0 interrupted iterations
default   [  71% ] 077/100 VUs  2m28.7s/3m30.0s

running (2m30.0s), 077/100 VUs, 5074 complete and 0 interrupted iterations
default   [  71% ] 077/100 VUs  2m29.7s/3m30.0s

running (2m31.0s), 076/100 VUs, 5124 complete and 0 interrupted iterations
default   [  72% ] 076/100 VUs  2m30.7s/3m30.0s

running (2m32.0s), 074/100 VUs, 5190 complete and 0 interrupted iterations
default   [  72% ] 074/100 VUs  2m31.7s/3m30.0s

running (2m33.0s), 074/100 VUs, 5237 complete and 0 interrupted iterations
default   [  73% ] 074/100 VUs  2m32.7s/3m30.0s

running (2m34.0s), 073/100 VUs, 5300 complete and 0 interrupted iterations
default   [  73% ] 073/100 VUs  2m33.7s/3m30.0s

running (2m35.0s), 072/100 VUs, 5348 complete and 0 interrupted iterations
default   [  74% ] 072/100 VUs  2m34.7s/3m30.0s

running (2m36.0s), 071/100 VUs, 5410 complete and 0 interrupted iterations
default   [  74% ] 071/100 VUs  2m35.7s/3m30.0s

running (2m37.0s), 071/100 VUs, 5455 complete and 0 interrupted iterations
default   [  75% ] 071/100 VUs  2m36.7s/3m30.0s

running (2m38.0s), 070/100 VUs, 5516 complete and 0 interrupted iterations
default   [  75% ] 070/100 VUs  2m37.7s/3m30.0s

running (2m39.0s), 068/100 VUs, 5561 complete and 0 interrupted iterations
default   [  76% ] 068/100 VUs  2m38.7s/3m30.0s

running (2m40.0s), 068/100 VUs, 5621 complete and 0 interrupted iterations
default   [  76% ] 068/100 VUs  2m39.7s/3m30.0s

running (2m41.0s), 068/100 VUs, 5663 complete and 0 interrupted iterations
default   [  77% ] 068/100 VUs  2m40.7s/3m30.0s

running (2m42.0s), 066/100 VUs, 5722 complete and 0 interrupted iterations
default   [  77% ] 066/100 VUs  2m41.7s/3m30.0s

running (2m43.0s), 065/100 VUs, 5764 complete and 0 interrupted iterations
default   [  77% ] 065/100 VUs  2m42.7s/3m30.0s

running (2m44.0s), 065/100 VUs, 5821 complete and 0 interrupted iterations
default   [  78% ] 065/100 VUs  2m43.7s/3m30.0s

running (2m45.0s), 064/100 VUs, 5862 complete and 0 interrupted iterations
default   [  78% ] 064/100 VUs  2m44.7s/3m30.0s

running (2m46.0s), 063/100 VUs, 5917 complete and 0 interrupted iterations
default   [  79% ] 063/100 VUs  2m45.7s/3m30.0s

running (2m47.0s), 063/100 VUs, 5957 complete and 0 interrupted iterations
default   [  79% ] 063/100 VUs  2m46.7s/3m30.0s

running (2m48.0s), 062/100 VUs, 6012 complete and 0 interrupted iterations
default   [  80% ] 062/100 VUs  2m47.7s/3m30.0s

running (2m49.0s), 060/100 VUs, 6051 complete and 0 interrupted iterations
default   [  80% ] 060/100 VUs  2m48.7s/3m30.0s

running (2m50.0s), 060/100 VUs, 6103 complete and 0 interrupted iterations
default   [  81% ] 060/100 VUs  2m49.7s/3m30.0s

running (2m51.0s), 059/100 VUs, 6141 complete and 0 interrupted iterations
default   [  81% ] 059/100 VUs  2m50.7s/3m30.0s

running (2m52.0s), 058/100 VUs, 6194 complete and 0 interrupted iterations
default   [  82% ] 058/100 VUs  2m51.7s/3m30.0s

running (2m53.0s), 057/100 VUs, 6230 complete and 0 interrupted iterations
default   [  82% ] 057/100 VUs  2m52.7s/3m30.0s

running (2m54.0s), 057/100 VUs, 6279 complete and 0 interrupted iterations
default   [  83% ] 057/100 VUs  2m53.7s/3m30.0s

running (2m55.0s), 056/100 VUs, 6315 complete and 0 interrupted iterations
default   [  83% ] 056/100 VUs  2m54.7s/3m30.0s

running (2m56.0s), 054/100 VUs, 6365 complete and 0 interrupted iterations
default   [  84% ] 054/100 VUs  2m55.7s/3m30.0s

running (2m57.0s), 054/100 VUs, 6399 complete and 0 interrupted iterations
default   [  84% ] 054/100 VUs  2m56.7s/3m30.0s

running (2m58.0s), 053/100 VUs, 6445 complete and 0 interrupted iterations
default   [  85% ] 053/100 VUs  2m57.7s/3m30.0s

running (2m59.0s), 052/100 VUs, 6479 complete and 0 interrupted iterations
default   [  85% ] 052/100 VUs  2m58.7s/3m30.0s

running (3m00.0s), 051/100 VUs, 6525 complete and 0 interrupted iterations
default   [  86% ] 051/100 VUs  2m59.7s/3m30.0s

running (3m01.0s), 051/100 VUs, 6557 complete and 0 interrupted iterations
default   [  86% ] 051/100 VUs  3m00.7s/3m30.0s

running (3m02.0s), 049/100 VUs, 6600 complete and 0 interrupted iterations
default   [  87% ] 049/100 VUs  3m01.7s/3m30.0s

running (3m03.0s), 047/100 VUs, 6632 complete and 0 interrupted iterations
default   [  87% ] 047/100 VUs  3m02.7s/3m30.0s

running (3m04.0s), 045/100 VUs, 6674 complete and 0 interrupted iterations
default   [  87% ] 045/100 VUs  3m03.7s/3m30.0s

running (3m05.0s), 045/100 VUs, 6702 complete and 0 interrupted iterations
default   [  88% ] 045/100 VUs  3m04.7s/3m30.0s

running (3m06.0s), 042/100 VUs, 6740 complete and 0 interrupted iterations
default   [  88% ] 042/100 VUs  3m05.7s/3m30.0s

running (3m07.0s), 041/100 VUs, 6767 complete and 0 interrupted iterations
default   [  89% ] 041/100 VUs  3m06.7s/3m30.0s

running (3m08.0s), 039/100 VUs, 6803 complete and 0 interrupted iterations
default   [  89% ] 039/100 VUs  3m07.7s/3m30.0s

running (3m09.0s), 038/100 VUs, 6827 complete and 0 interrupted iterations
default   [  90% ] 038/100 VUs  3m08.7s/3m30.0s

running (3m10.0s), 036/100 VUs, 6859 complete and 0 interrupted iterations
default   [  90% ] 036/100 VUs  3m09.7s/3m30.0s

running (3m11.0s), 034/100 VUs, 6882 complete and 0 interrupted iterations
default   [  91% ] 034/100 VUs  3m10.7s/3m30.0s

running (3m12.0s), 033/100 VUs, 6912 complete and 0 interrupted iterations
default   [  91% ] 033/100 VUs  3m11.7s/3m30.0s

running (3m13.0s), 031/100 VUs, 6932 complete and 0 interrupted iterations
default   [  92% ] 031/100 VUs  3m12.7s/3m30.0s

running (3m14.0s), 029/100 VUs, 6959 complete and 0 interrupted iterations
default   [  92% ] 029/100 VUs  3m13.7s/3m30.0s

running (3m15.0s), 027/100 VUs, 6977 complete and 0 interrupted iterations
default   [  93% ] 027/100 VUs  3m14.7s/3m30.0s

running (3m16.0s), 026/100 VUs, 7001 complete and 0 interrupted iterations
default   [  93% ] 026/100 VUs  3m15.7s/3m30.0s

running (3m17.0s), 024/100 VUs, 7017 complete and 0 interrupted iterations
default   [  94% ] 024/100 VUs  3m16.7s/3m30.0s

running (3m18.0s), 022/100 VUs, 7038 complete and 0 interrupted iterations
default   [  94% ] 022/100 VUs  3m17.7s/3m30.0s

running (3m19.0s), 020/100 VUs, 7052 complete and 0 interrupted iterations
default   [  95% ] 020/100 VUs  3m18.7s/3m30.0s

running (3m20.0s), 019/100 VUs, 7070 complete and 0 interrupted iterations
default   [  95% ] 019/100 VUs  3m19.7s/3m30.0s

running (3m21.0s), 017/100 VUs, 7082 complete and 0 interrupted iterations
default   [  96% ] 017/100 VUs  3m20.7s/3m30.0s

running (3m22.0s), 015/100 VUs, 7097 complete and 0 interrupted iterations
default   [  96% ] 015/100 VUs  3m21.7s/3m30.0s

running (3m23.0s), 014/100 VUs, 7106 complete and 0 interrupted iterations
default   [  97% ] 014/100 VUs  3m22.7s/3m30.0s

running (3m24.0s), 012/100 VUs, 7120 complete and 0 interrupted iterations
default   [  97% ] 012/100 VUs  3m23.7s/3m30.0s

running (3m25.0s), 010/100 VUs, 7127 complete and 0 interrupted iterations
default   [  97% ] 010/100 VUs  3m24.7s/3m30.0s

running (3m26.0s), 009/100 VUs, 7137 complete and 0 interrupted iterations
default   [  98% ] 009/100 VUs  3m25.7s/3m30.0s

running (3m27.0s), 008/100 VUs, 7142 complete and 0 interrupted iterations
default   [  98% ] 008/100 VUs  3m26.7s/3m30.0s

running (3m28.0s), 006/100 VUs, 7150 complete and 0 interrupted iterations
default   [  99% ] 006/100 VUs  3m27.7s/3m30.0s

running (3m29.0s), 005/100 VUs, 7153 complete and 0 interrupted iterations
default   [  99% ] 005/100 VUs  3m28.7s/3m30.0s

running (3m30.0s), 003/100 VUs, 7158 complete and 0 interrupted iterations
default   [ 100% ] 003/100 VUs  3m29.7s/3m30.0s

running (3m31.0s), 001/100 VUs, 7160 complete and 0 interrupted iterations
default ↓ [ 100% ] 003/100 VUs  3m30s


  █ THRESHOLDS 

    errors
    ✓ 'rate<0.02' rate=0.00%

    http_req_duration
    ✓ 'p(95)<500' p(95)=10.79ms

    http_req_failed
    ✓ 'rate<0.02' rate=0.00%


  █ TOTAL RESULTS 

    checks_total.......: 71711   339.860696/s
    checks_succeeded...: 100.00% 71711 out of 71711
    checks_failed......: 0.00%   0 out of 71711

    ✓ register status 200/201/409
    ✓ login status 200/201
    ✓ /faculties status 200
    ✓ /faculties p95<500ms (soft)
    ✓ /categories status 200
    ✓ /categories p95<500ms (soft)
    ✓ /questions status 200
    ✓ /questions p95<500ms (soft)
    ✓ /answers status 200
    ✓ /answers p95<500ms (soft)
    ✓ profiles status 200
    ✓ profile by id 200

    CUSTOM
    errors.........................: 0.00% 0 out of 0

    HTTP
    http_req_duration..............: avg=4.47ms min=340µs med=3.68ms max=99.09ms p(90)=8.49ms p(95)=10.79ms
      { expected_response:true }...: avg=4.47ms min=340µs med=3.68ms max=99.09ms p(90)=8.49ms p(95)=10.79ms
    http_req_failed................: 0.00% 0 out of 43067
    http_reqs......................: 43067 204.107886/s

    EXECUTION
    iteration_duration.............: avg=1.32s  min=1.3s  med=1.32s  max=1.53s   p(90)=1.34s  p(95)=1.34s  
    iterations.....................: 7161  33.938203/s
    vus............................: 1     min=1          max=100
    vus_max........................: 100   min=100        max=100

    NETWORK
    data_received..................: 40 MB 191 kB/s
    data_sent......................: 18 MB 85 kB/s




running (3m31.0s), 000/100 VUs, 7161 complete and 0 interrupted iterations
default ✓ [ 100% ] 000/100 VUs  3m30s
